{"conditions":{"raw.0.6":{"reason":null,"status":"computed","value":{"biologically_independent_unit_count":{"reason":"NOT_ESTIMATED_BY_ALGORITHMIC_RESAMPLING","status":"unavailable","value":null},"n_declared_resampling_units":310,"n_reference_observations":310,"protocol_version":"domains.stability_power.v0.2","quality_thresholds":{"ari_p10":0.8,"max_reference_noise":0.4,"median_ari":0.9,"median_pair_support":0.8,"min_pair_exposures":10,"min_pairs_per_cluster":10,"min_planned_candidate_coverage":0.95,"min_success_fraction":0.9,"noise_p10":0.9},"settings":[{"reason":null,"status":"computed","value":{"ari_p10":0.2660083349581974,"ari_summary":{"reason":null,"status":"computed","value":{"count":60.0,"max":0.9749653337183087,"mean":0.7392842932183438,"median":0.9113024939804202,"min":0.16447642909814245,"q25":0.4734552264733523,"q75":0.9471475632592627,"sd":0.2805537014369768}},"attempted_draws":60,"biological_sampling_uncertainty":false,"classification":"fragile_structure","cluster_pair_support":[{"n_pairs_exposed_at_least_10":32,"reference_label":0,"support_summary":{"reason":null,"status":"computed","value":{"count":32.0,"max":1.0,"mean":0.7673482304993002,"median":0.7669683257918551,"min":0.47058823529411764,"q25":0.6494755244755245,"q75":0.8743961352657005,"sd":0.15022649546829017}}},{"n_pairs_exposed_at_least_10":32,"reference_label":1,"support_summary":{"reason":null,"status":"computed","value":{"count":32.0,"max":1.0,"mean":0.92074575754611,"median":0.9614814814814814,"min":0.45454545454545453,"q25":0.9132142857142858,"q75":1.0,"sd":0.1317263322892017}}},{"n_pairs_exposed_at_least_10":32,"reference_label":2,"support_summary":{"reason":null,"status":"computed","value":{"count":32.0,"max":1.0,"mean":0.9544176337583087,"median":1.0,"min":0.8181818181818182,"q25":0.9356060606060606,"q75":1.0,"sd":0.06187003108228773}}},{"n_pairs_exposed_at_least_10":32,"reference_label":3,"support_summary":{"reason":null,"status":"computed","value":{"count":32.0,"max":1.0,"mean":0.9649715293526077,"median":0.9642857142857143,"min":0.875,"q25":0.9473684210526315,"q75":1.0,"sd":0.03919229048737434}}},{"n_pairs_exposed_at_least_10":32,"reference_label":4,"support_summary":{"reason":null,"status":"computed","value":{"count":32.0,"max":1.0,"mean":0.9676443868631369,"median":1.0,"min":0.8846153846153846,"q25":0.9503968253968254,"q75":1.0,"sd":0.04224123084001262}}}],"continuum_classification":{"reason":"SEPARATE_CONTINUUM_PROTOCOL_NOT_QUALIFIED","status":"unavailable","value":null},"eligible_ari_draws":60,"gates":{"eligible_ari_support":true,"execution_support":true,"pair_support":true,"planned_feasibility":true,"quality":false},"min_cluster_size":8,"noise_agreement_p10":0.9301075268817204,"noise_agreement_summary":{"reason":null,"status":"computed","value":{"count":60.0,"max":0.989247311827957,"mean":0.9528673835125447,"median":0.9516129032258065,"min":0.9193548387096774,"q25":0.9408602150537635,"q75":0.9623655913978495,"sd":0.017297640307194825}},"pair_panel_ref":{"path":"stability-batches/ucph_tablet_nir.raw.0.6.json","sha256":"242166543741118a0743ac66da257887c59d32606449930a9bc0f95198ae4fea"},"reference_cluster_counts":{"0":222,"1":26,"2":20,"3":11,"4":13},"scope":"Canonical observation-conditional algorithmic resampling; original specimen/reference correspondence not verified.","successful_draws":60}},{"reason":null,"status":"computed","value":{"ari_p10":0.3639983622575002,"ari_summary":{"reason":null,"status":"computed","value":{"count":60.0,"max":0.9815018206116123,"mean":0.7560448906178665,"median":0.8594119833361332,"min":0.18786381238817176,"q25":0.5375862601539143,"q75":0.9104521825670044,"sd":0.23574288378373098}},"attempted_draws":60,"biological_sampling_uncertainty":false,"classification":"fragile_structure","cluster_pair_support":[{"n_pairs_exposed_at_least_10":32,"reference_label":0,"support_summary":{"reason":null,"status":"computed","value":{"count":32.0,"max":1.0,"mean":0.8085520261264494,"median":0.8192934782608696,"min":0.5833333333333334,"q25":0.6923076923076923,"q75":0.9317226890756303,"sd":0.13702004354707628}}},{"n_pairs_exposed_at_least_10":32,"reference_label":1,"support_summary":{"reason":null,"status":"computed","value":{"count":32.0,"max":1.0,"mean":0.9798693783068783,"median":1.0,"min":0.7727272727272727,"q25":1.0,"q75":1.0,"sd":0.05826953307374862}}},{"n_pairs_exposed_at_least_10":32,"reference_label":2,"support_summary":{"reason":null,"status":"computed","value":{"count":32.0,"max":1.0,"mean":0.9719296906796907,"median":1.0,"min":0.5925925925925926,"q25":1.0,"q75":1.0,"sd":0.0820391970342368}}},{"n_pairs_exposed_at_least_10":32,"reference_label":3,"support_summary":{"reason":null,"status":"computed","value":{"count":32.0,"max":1.0,"mean":1.0,"median":1.0,"min":1.0,"q25":1.0,"q75":1.0,"sd":0.0}}}],"continuum_classification":{"reason":"SEPARATE_CONTINUUM_PROTOCOL_NOT_QUALIFIED","status":"unavailable","value":null},"eligible_ari_draws":60,"gates":{"eligible_ari_support":true,"execution_support":true,"pair_support":true,"planned_feasibility":true,"quality":false},"min_cluster_size":12,"noise_agreement_p10":0.946236559139785,"noise_agreement_summary":{"reason":null,"status":"computed","value":{"count":60.0,"max":0.9946236559139785,"mean":0.9657706093189963,"median":0.967741935483871,"min":0.9139784946236559,"q25":0.956989247311828,"q75":0.9731182795698925,"sd":0.014343370760783472}},"pair_panel_ref":{"path":"stability-batches/ucph_tablet_nir.raw.0.6.json","sha256":"242166543741118a0743ac66da257887c59d32606449930a9bc0f95198ae4fea"},"reference_cluster_counts":{"0":222,"1":26,"2":29,"3":20},"scope":"Canonical observation-conditional algorithmic resampling; original specimen/reference correspondence not verified.","successful_draws":60}}],"unit_scope":"Canonical observation-conditional algorithmic resampling; original specimen/reference correspondence not verified."}},"raw.0.8":{"reason":null,"status":"computed","value":{"biologically_independent_unit_count":{"reason":"NOT_ESTIMATED_BY_ALGORITHMIC_RESAMPLING","status":"unavailable","value":null},"n_declared_resampling_units":310,"n_reference_observations":310,"protocol_version":"domains.stability_power.v0.2","quality_thresholds":{"ari_p10":0.8,"max_reference_noise":0.4,"median_ari":0.9,"median_pair_support":0.8,"min_pair_exposures":10,"min_pairs_per_cluster":10,"min_planned_candidate_coverage":0.95,"min_success_fraction":0.9,"noise_p10":0.9},"settings":[{"reason":null,"status":"computed","value":{"ari_p10":0.503838616868875,"ari_summary":{"reason":null,"status":"computed","value":{"count":60.0,"max":0.9905630811403822,"mean":0.8614300217023348,"median":0.9496155427896483,"min":0.1363625239910277,"q25":0.9206531852972341,"q75":0.9707046936651692,"sd":0.21307825774564768}},"attempted_draws":60,"biological_sampling_uncertainty":false,"classification":"fragile_structure","cluster_pair_support":[{"n_pairs_exposed_at_least_10":32,"reference_label":0,"support_summary":{"reason":null,"status":"computed","value":{"count":32.0,"max":1.0,"mean":0.8981900450870647,"median":0.8918918918918919,"min":0.7804878048780488,"q25":0.868421052631579,"q75":0.9150735294117647,"sd":0.052960361074479594}}},{"n_pairs_exposed_at_least_10":32,"reference_label":1,"support_summary":{"reason":null,"status":"computed","value":{"count":32.0,"max":1.0,"mean":0.9149456354426939,"median":0.9388004895960832,"min":0.5121951219512195,"q25":0.8993589743589744,"q75":1.0,"sd":0.12157294201774091}}},{"n_pairs_exposed_at_least_10":32,"reference_label":2,"support_summary":{"reason":null,"status":"computed","value":{"count":32.0,"max":1.0,"mean":0.9822312044643171,"median":1.0,"min":0.8947368421052632,"q25":0.9738247863247863,"q75":1.0,"sd":0.03169488932705186}}},{"n_pairs_exposed_at_least_10":32,"reference_label":3,"support_summary":{"reason":null,"status":"computed","value":{"count":32.0,"max":1.0,"mean":0.9816803205642625,"median":1.0,"min":0.9428571428571428,"q25":0.9665775401069518,"q75":1.0,"sd":0.021410494637477618}}},{"n_pairs_exposed_at_least_10":32,"reference_label":4,"support_summary":{"reason":null,"status":"computed","value":{"count":32.0,"max":1.0,"mean":0.9776948312661163,"median":1.0,"min":0.8717948717948718,"q25":0.9733187134502924,"q75":1.0,"sd":0.039097146193766356}}}],"continuum_classification":{"reason":"SEPARATE_CONTINUUM_PROTOCOL_NOT_QUALIFIED","status":"unavailable","value":null},"eligible_ari_draws":60,"gates":{"eligible_ari_support":true,"execution_support":true,"pair_support":true,"planned_feasibility":true,"quality":false},"min_cluster_size":8,"noise_agreement_p10":0.9395161290322581,"noise_agreement_summary":{"reason":null,"status":"computed","value":{"count":60.0,"max":0.9919354838709677,"mean":0.9636424731182793,"median":0.9717741935483871,"min":0.8387096774193549,"q25":0.9627016129032258,"q75":0.9758064516129032,"sd":0.025496745536129704}},"pair_panel_ref":{"path":"stability-batches/ucph_tablet_nir.raw.0.8.json","sha256":"00910983eb91c39dd3cb3a2a6d8d405c049a87ed54e472b86bc39c5d35ad4fd9"},"reference_cluster_counts":{"0":222,"1":26,"2":20,"3":11,"4":13},"scope":"Canonical observation-conditional algorithmic resampling; original specimen/reference correspondence not verified.","successful_draws":60}},{"reason":null,"status":"computed","value":{"ari_p10":0.6611843631816537,"ari_summary":{"reason":null,"status":"computed","value":{"count":60.0,"max":0.9983015981009621,"mean":0.8944170819816496,"median":0.9605354407332298,"min":0.25834623768272497,"q25":0.9139213121795478,"q75":0.9743358133480545,"sd":0.1733936918864304}},"attempted_draws":60,"biological_sampling_uncertainty":false,"classification":"fragile_structure","cluster_pair_support":[{"n_pairs_exposed_at_least_10":32,"reference_label":0,"support_summary":{"reason":null,"status":"computed","value":{"count":32.0,"max":1.0,"mean":0.9315569945405933,"median":0.9220647773279352,"min":0.8292682926829268,"q25":0.9090909090909091,"q75":0.9490384615384615,"sd":0.043500344307565504}}},{"n_pairs_exposed_at_least_10":32,"reference_la